{
  "aggregate_scores": [],
  "benchmark_contract_sha256": "59d564e96d27e506b055a49336c76795a0bfb5e8908e567cca8d323921e58661",
  "benchmark_id": "m20_fixture_demo",
  "benchmark_version": "1.0.0",
  "comparability_status": "provisional",
  "evaluation_posture": "contract_only",
  "gating_outcomes": [],
  "metric_rows": [
    {
      "metric_id": "m1",
      "unit": "count",
      "value": null
    },
    {
      "metric_id": "m2",
      "unit": "ratio",
      "value": null
    }
  ],
  "non_claims": [
    "starlab.m20.scorecard_non_claim.not_real_evaluation"
  ],
  "schema_version": "starlab.benchmark_scorecard.v1",
  "scoring_status": "unscored",
  "subject_ref": {
    "subject_id": "fixture_subject_001",
    "subject_kind": "scripted"
  },
  "warnings": [
    "starlab.m20.warning.contract_only_fixture"
  ]
}
